{
  "$schema": "http://json-schema.org/draft-07/schema#",
  "$id": "https://faultynode.github.io/commentaries/synthesis/schema/inheritance.schema.json",
  "title": "Inheritance record",
  "description": "Stage 3. Same corpus, different question: where does the author engage a predecessor, and in what mode. The mode column is what turns a citation list into a genealogy, so it is required and closed.",
  "type": "object",
  "additionalProperties": false,
  "required": [
    "schema_version",
    "commentary",
    "source_sha256",
    "extracted_at",
    "coverage",
    "engagements"
  ],
  "properties": {
    "schema_version": { "const": 1 },
    "commentary": { "type": "string", "pattern": "^[a-z0-9-]+$" },
    "source_sha256": { "type": "string", "pattern": "^[0-9a-f]{64}$" },
    "extracted_at": { "type": "string", "pattern": "^[0-9]{4}-[0-9]{2}-[0-9]{2}$" },
    "extractor": {
      "type": "object",
      "additionalProperties": false,
      "required": ["agent", "prompt"],
      "properties": {
        "agent": { "type": "string" },
        "model": {
          "type": "string",
          "description": "Model identifier for the pass, as the provider names it (e.g. claude-opus-5). Optional, and never supplied from memory: a record written before this field existed omits it rather than guessing which model wrote it."
        },
        "prompt": { "type": "string" },
        "note": { "type": "string" }
      }
    },
    "coverage": { "type": "string", "enum": ["complete", "partial"] },
    "coverage_note": { "type": "string" },
    "predecessors_queried": {
      "type": "array",
      "minItems": 1,
      "items": { "type": "string", "minLength": 2 },
      "description": "The names this pass used as retrieval keys, as searched ('Heidegger', 'neo-Kantian'). A name listed here with no engagement means searched and nothing found that does work in one of the five modes; a name absent from it means not searched. Omit it when the whole commentary was read (coverage complete), and never reconstruct it for an older pass whose note does not say what was searched."
    },
    "engagements": { "type": "array", "items": { "$ref": "#/$defs/engagement" } }
  },
  "$defs": {
    "engagement": {
      "type": "object",
      "additionalProperties": false,
      "required": ["id", "locator", "predecessor", "mode", "claim", "quote"],
      "properties": {
        "id": { "type": "string", "pattern": "^inh/[a-z0-9-]+/[0-9]{3}$" },
        "locator": { "type": "string", "pattern": "^[a-z0-9-]+#[a-z0-9-]+$" },
        "primary_locator": { "type": "string" },
        "stratum": { "type": "string" },
        "predecessor": {
          "type": "object",
          "additionalProperties": false,
          "required": ["author"],
          "properties": {
            "author": { "type": "string" },
            "text": {
              "type": "string",
              "description": "The predecessor text, only where the commentary identifies it. Omit rather than infer."
            },
            "locator": {
              "type": "string",
              "minLength": 1,
              "description": "Where in the predecessor's text the engagement bears, as the commentary cites it ('Ideas I § 42', 'A 141 / B 180', '§§ 62-74'). It names a P-locus for a comparative run, so only a citation the commentary itself gives; never supplied, never converted to another edition."
            }
          }
        },
        "mode": {
          "type": "string",
          "enum": [
            "silent-appropriation",
            "acknowledged-debt",
            "polemical-rejection",
            "terminological-borrowing",
            "destructive-appropriation"
          ],
          "description": "The last value is a local addition: Destruktion takes over a concept and dismantles its received sense in one move, which neither rejection nor borrowing describes. Use it only where the commentary presents both halves."
        },
        "claim": { "type": "string", "minLength": 12, "maxLength": 400 },
        "quote": { "type": "string", "minLength": 24, "maxLength": 400 }
      }
    }
  }
}
